{
  "id": "CHAIN_OF_PLAN_LINK",
  "name": "CHAIN_OF_PLAN_LINK",
  "defaults_processes": {
    "notifications": {
      "on_start": [
        {
          "id": "console_default",
          "message": "[[DP]]! PROCESS @GV(PROCESS_ID) START - TS:@GV(TEST_NUMBER)"
        }
      ],
      "on_retry": [
        {
          "id": "console_default",
          "message": "[[DP]]! RETRY PROCESS @GV(PROCESS_ID): @GV(PROCESS_EXEC_ERR_OUTPUT) - TS:@GV(TEST_NUMBER)"
        }
      ],
      "on_fail": [
        {
          "id": "console_default",
          "message": "[[DP]]! ERR! PROCESS @GV(PROCESS_ID) FAIL: @GV(PROCESS_EXEC_ERR_OUTPUT)"
        }
      ],
      "on_end": [
        {
          "id": "console_default",
          "message": "[[DP]]! PROCESS @GV(PROCESS_ID) END - TS:@GV(TEST_NUMBER)"
        }
      ]
    },
    "chain_action_on_fail": "abort"
  },
  "notifications": {
    "on_start": [
      {
        "id": "console_default",
        "message": "CHAIN @GV(CHAIN_ID) START"
      }
    ],
    "on_end": [
      {
        "id": "console_default",
        "message": "CHAIN @GV(CHAIN_ID) END"
      }
    ],
    "on_fail": [
      {
        "id": "console_default",
        "message": "CHAIN @GV(CHAIN_ID) FAIL"
      }
    ]
  },
  "processes": [
    {
      "id": "PROCESS_ONE",
      "name": "PROCESS_ONE",
      "exec": {
        "id": "shell_default",
        "command": "sleep 0.2 && echo TEST"
      },
      "output_share": [
        {
          "key": "TEST",
          "name": "NUMBER",
          "value": "@GV(PROCESS_EXEC_MSG_OUTPUT)"
        }
      ]
    }
  ]
}
